{
  "lesson_id": "P01-M03-L03",
  "title": "Commit Bodies and Footers — Explaining the Why",
  "module_id": "P01-M03",
  "phase_id": "P01",
  "estimated_minutes": 30,
  "lesson_type": "hands-on",
  "prerequisites": ["P01-M03-L02"],
  "learning_objectives": [
    "Identify when a commit body is necessary vs. when the subject line is enough",
    "Write a commit body that explains motivation and context, not implementation",
    "Format commit bodies using the 72-character line wrap rule",
    "Use commit footers to reference GitHub issues (Closes #N, Refs #N)",
    "Write a complete, well-structured commit with subject, body, and footer"
  ],
  "outline": [
    "When to write a body: complex changes, non-obvious decisions, breaking changes",
    "What goes in a body: motivation, context, trade-offs — not what the diff shows",
    "The 72-character wrap rule for body lines",
    "Blank line separator: subject → blank line → body",
    "Footer syntax: Closes #N, Fixes #N, Refs #N, BREAKING CHANGE:",
    "Hands-on: Write one complete commit (subject + body + footer) for a Helm change"
  ],
  "key_terms": [
    "commit body",
    "commit footer",
    "72-character wrap",
    "Closes keyword",
    "Refs keyword",
    "BREAKING CHANGE",
    "blank line separator"
  ],
  "helm_context": {
    "feature": "Documented design decisions in Helm commit history",
    "deliverable": "One commit with a well-written body explaining a Helm architectural decision",
    "code_location": "helm/ (README or initial project structure)"
  },
  "assessment": {
    "type": "hands-on-exercise",
    "criteria": [
      "Subject line meets 50-char rule and imperative mood (from L02)",
      "Blank line correctly separates subject from body",
      "Body explains motivation or context, not just what changed",
      "Body lines wrap at 72 characters",
      "Footer includes at least one issue reference using correct syntax"
    ]
  },
  "resources": [
    {
      "type": "article",
      "title": "How to Write a Git Commit Message (Chris Beams)",
      "url": "https://cbea.ms/git-commit/"
    },
    {
      "type": "documentation",
      "title": "Conventional Commits — Body and Footer",
      "url": "https://www.conventionalcommits.org/en/v1.0.0/#specification"
    }
  ],
  "professor_constraints": [
    "Use Helm-specific examples — a design decision about data model, Google Calendar sync approach, etc.",
    "Emphasize: 'explain why you made this choice, not what the code does'",
    "Show a before/after: same change with only a subject vs. with a full body",
    "Keep the hands-on exercise to one commit — quality over quantity"
  ],
  "metadata": {
    "created_at": "2026-02-25",
    "generated_by": "Curriculum Designer (Claude)"
  }
}
